{
  "receipt_id": "RCPT_2025_001",
  "purchase_date": "2025-11-27",
  "store_name": "SuperMarket Plus",
  "cashier_id": "CSH_001",
  "payment_method": "Credit Card",
  "total_amount": 147.90,
  "customer": {
    "customer_id": "CUST_12345",
    "name": "John Doe",
    "phone": "+254712345678",
    "email": "john.doe@email.com",
    "loyalty_member": true,
    "member_since": "2020-03-15"
  },
  "store": {
    "store_id": "STORE_001",
    "name": "SuperMarket Plus",
    "address": "123 Main Street, Nairobi, Kenya",
    "city": "Nairobi",
    "country": "Kenya",
    "postal_code": "00100",
    "phone": "+254201234567",
    "email": "info@supermarketplus.co.ke",
    "tax_id": "TIN123456789",
    "business_license": "BL789456123"
  },
  "items": [
    {
      "item_id": "001",
      "name": "Premium Coffee Beans",
      "category": "Food & Beverages",
      "subcategory": "Coffee",
      "description": "Organic Arabica Coffee Beans 1kg - Premium Grade",
      "brand": "Mountain Peak",
      "barcode": "1234567890123",
      "quantity": 2,
      "unit_price": 25.99,
      "subtotal": 51.98,
      "tax_applied": true,
      "discount_eligible": true
    },
    {
      "item_id": "002",
      "name": "Whole Wheat Bread",
      "category": "Bakery",
      "subcategory": "Bread",
      "description": "Freshly baked whole wheat loaf - 800g",
      "brand": "Artisan Bakers",
      "barcode": "1234567890124",
      "quantity": 1,
      "unit_price": 15.50,
      "subtotal": 15.50,
      "tax_applied": true,
      "discount_eligible": false
    },
    {
      "item_id": "003",
      "name": "Greek Yogurt",
      "category": "Dairy",
      "subcategory": "Yogurt",
      "description": "Plain Greek yogurt 500g - Low fat",
      "brand": "Dairy Fresh",
      "barcode": "1234567890125",
      "quantity": 3,
      "unit_price": 8.75,
      "subtotal": 26.25,
      "tax_applied": true,
      "discount_eligible": true
    },
    {
      "item_id": "004",
      "name": "Organic Bananas",
      "category": "Fresh Produce",
      "subcategory": "Fruits",
      "description": "Fresh organic bananas per kg",
      "brand": "Green Valley Farms",
      "barcode": "1234567890126",
      "quantity": 1,
      "unit_price": 12.99,
      "subtotal": 12.99,
      "tax_applied": false,
      "discount_eligible": true
    },
    {
      "item_id": "005",
      "name": "Chicken Breast",
      "category": "Meat & Poultry",
      "subcategory": "Poultry",
      "description": "Fresh chicken breast (skinless, boneless) - 1kg",
      "brand": "Farm Fresh",
      "barcode": "1234567890127",
      "quantity": 1,
      "unit_price": 20.78,
      "subtotal": 20.78,
      "tax_applied": true,
      "discount_eligible": false
    },
    {
      "item_id": "006",
      "name": "Avocados",
      "category": "Fresh Produce",
      "subcategory": "Fruits",
      "description": "Fresh Hass avocados - 3 pieces pack",
      "brand": "Green Valley Farms",
      "barcode": "1234567890128",
      "quantity": 1,
      "unit_price": 8.99,
      "subtotal": 8.99,
      "tax_applied": false,
      "discount_eligible": true
    },
    {
      "item_id": "007",
      "name": "Eggs",
      "category": "Dairy",
      "subcategory": "Eggs",
      "description": "Free-range eggs - 6 pieces carton",
      "brand": "Happy Farm",
      "barcode": "1234567890129",
      "quantity": 2,
      "unit_price": 3.49,
      "subtotal": 6.98,
      "tax_applied": true,
      "discount_eligible": true
    }
  ],
  "pricing": {
    "subtotal": 143.47,
    "subtotal_excl_tax": 126.45,
    "tax_details": {
      "tax": [
        {
          "type": "VAT",
          "rate": 0.16,
          "amount": 22.95
        },
        {
          "type": "County_Tax",
          "rate": 0.01,
          "amount": 1.43
        }
      ]
    },
    "discounts": {
      "discount": [
        {
          "type": "loyalty_points",
          "amount": 0.00,
          "description": "Loyalty points discount"
        },
        {
          "type": "promotional",
          "amount": 0.00,
          "description": "Promotional discount"
        }
      ]
    },
    "charges": {
      "charge": [
        {
          "type": "service_fee",
          "amount": 0.00
        },
        {
          "type": "delivery_fee",
          "amount": 0.00
        }
      ]
    },
    "grand_total": 147.90,
    "rounding_adjustment": 0.05
  },
  "payment": {
    "method": "Credit Card",
    "card_type": "Visa",
    "card_number_last_four": "4567",
    "card_holder_name": "John Doe",
    "authorization_code": "AUTH123456789",
    "transaction_id": "TXN789123456",
    "payment_time": "2025-11-27T14:30:25Z",
    "approved_amount": 147.90
  },
  "loyalty": {
    "points_earned": 15,
    "points_redeemed": 0,
    "total_points_balance": 342,
    "member_tier": "Gold"
  },
  "transaction": {
    "transaction_id": "TXN_2025_001_456",
    "receipt_number": "RCPT_2025_001_456",
    "terminal_id": "TERM_001",
    "cashier_id": "CSH_001",
    "shift_id": "SHIFT_001",
    "register_number": "REG_003"
  },
  "footer": {
    "receipt_time": "2025-11-27T14:30:25Z",
    "print_time": "2025-11-27T14:30:26Z",
    "thank_you_message": "Thank you for shopping with us!",
    "return_policy": "30-day return policy with original receipt",
    "feedback_message": "Rate your experience: www.supermarketplus.co.ke/feedback",
    "website": "www.supermarketplus.co.ke",
    "social_media": {
      "facebook": "facebook.com/supermarketplus",
      "twitter": "@supermarketplus",
      "instagram": "instagram.com/supermarketplus"
    }
  },
  "digital_signature": {
    "algorithm": "SHA256",
    "signature": "a1b2c3d4e5f6789012345678901234567890abcdef1234567890abcdef1234567890abcdef1234567890abcdef1234567890",
    "timestamp": "2025-11-27T14:30:25Z"
  }
}